{
  "schemaVersion": "0.1.0",
  "input": {
    "commandFamily": "cargo-check-jsonl",
    "path": "validation/ports/libpng/reports/iteration-007/cargo-check.jsonl",
    "audienceMode": "beginner"
  },
  "summary": {
    "totalDiagnostics": 0,
    "supportedDiagnostics": 0,
    "unsupportedDiagnostics": 0,
    "ownershipDiagnostics": 0,
    "nonOwnershipDiagnostics": 0
  },
  "diagnostics": []
}
