{
  "schemaVersion": "0.1.0",
  "input": {
    "commandFamily": "cargo-check-jsonl",
    "path": "/workspaces/rust-ownership-error-navigation/validation/ports/redis/reports/iteration-021/cargo-check.jsonl"
  },
  "summary": {
    "totalDiagnostics": 0,
    "supportedDiagnostics": 0,
    "unsupportedDiagnostics": 0
  },
  "diagnostics": []
}
